Question,Answer
"클라우드 인프라 보안에서 네트워크 격리가 중요한 이유는 무엇입니까?","네트워크 격리는 클라우드 인프라에서 다른 구성 요소 또는 사용자를 분리하여 측면 이동 공격 및 무단 액세스를 방지합니다.네트워크 격리를 통해 공격 표면을 줄이고 시스템에서의 공격자의 활동 범위를 제한 할 수 있으며 전반적인 보안을 개선 할 수 있습니다."
"클라우드 네이티브 보안의 기능과 장점을 설명하십시오.","Cloud-Native Security는 클라우드 네이티브 응용 프로그램 및 환경을위한 새로운 보안 방어 모델을 말합니다.그 특성에는 마이크로 서비스 아키텍처, 컨테이너화 된 배포 및 자동화 된 운영 및 유지 보수가 포함됩니다.유연성, 확장 성 및 자동화 보안이 포함됩니다."
"클라우드 환경에서 데이터 암호화의 엔드 투 엔드 보호를 달성하는 방법은 무엇입니까?","엔드 투 엔드 데이터 암호화 보호를 달성하려면 모든 데이터 전송 및 스토리지의 모든 단계에서 암호화 측정을 수행해야합니다.여기에는 전송 중 데이터 보안을 보호하기 위해 전송 계층 암호화 (TLS \\/SSL)를 사용하여 데이터가 저장 될 때 데이터 보안을 보호하기 위해 암호화 알고리즘을 사용하는 것이 포함됩니다."
"클라우드 환경에서 공급망 보안 위험을 다루는 방법은 무엇입니까?","공급망 보안 위험을 처리하려면 공급 업체 평가 및 관리를 강화하고 공급망 보안 관리를 구현하며 공급망 보안 협력 메커니즘 및 기타 조치를 구축해야합니다.조직은 공급 업체 보안 평가 도구, 공급 업체 규정 준수 검사, 공급 업체 보안 교육 및 기타 방법을 사용하여 공급망 보안 위험의 관리 및 제어를 개선 할 수 있습니다."
"클라우드 환경에서 규정 준수 및 감사 요구 사항을 달성하는 방법은 무엇입니까?","준수 및 감사 요구 사항을 달성하려면 규정 준수 프레임 워크를 설정하고 규정 준수 제어를 구현하며 정기 준수 감사 및보고 조치를 수행해야합니다.조직은 규정 준수 자동화 도구 및 클라우드 보안 솔루션으로 규정 준수 관리의 효율성과 안정성을 향상시킬 수 있습니다."
"""포트 스캔""이란 무엇이며 클라우드 보안에서 그 역할은 무엇입니까?","포트 스캐닝은 대상 시스템에서 개방형 네트워크 포트 및 실행 네트워크 서비스를 발견하는 데 사용되는 네트워크 정찰 기술입니다.공격자는 종종 포트 스캔을 사용하여 잠재적 목표를 식별하고 시스템의 취약점을 찾습니다.클라우드 보안에서 포트 스캔을 사용하여 클라우드 인스턴스의 노출 위험 및 네트워크 구성 오류를 감지 할 수 있습니다."
"클라우드 보안에서 ""컨테이너 오케스트레이션 플랫폼""의 역할 및 보안 고려 사항을 설명하십시오.","컨테이너 오케스트레이션 플랫폼은 컨테이너화 된 애플리케이션을 관리하고 배포하기위한 도구입니다.클라우드 보안에서 컨테이너 오케스트레이션 플랫폼은 보안 구성, 액세스 제어, 컨테이너 격리 및 취약성 관리와 같은 기능을 제공 할 수 있습니다.보안 고려 사항에는 플랫폼 보안, 컨테이너 보안 및 응용 프로그램 보안이 포함됩니다."
"클라우드 가속도는 액세스 속도를 어떻게 개선합니까?","클라우드 가속 기능은 JavaScript, CSS, 그림, HTML 및 소스 사이트의 기타 파일을 압축하고 캐시합니다. 사용자가 이러한 파일 리소스를 다시 요청하면 근처의 고품질 노드 컴퓨터 실을 선택하여 클라우드 보호 노드에 캐시 된 파일을 얻으므로 액세스 속도가 크게 향상됩니다."
"클라우드 환경에서 ""보안 구성 관리""의 중요성과 구현을 설명하십시오.","보안 구성 관리는 클라우드 인프라의 다양한 구성 요소에 대한 보안 구성 및 지속적인 모니터링 프로세스를 말합니다.시스템 취약점 및 공격 표면을 줄이기위한 운영 체제, 네트워크 장치, 응용 프로그램 등의 보안 구성이 포함됩니다."
"클라우드 환경에서 제로 데이 취약점을 다루는 방법은 무엇입니까?","제로 데이 취약성에 대응하려면 취약성 관리 및 위협 인텔리전스 모니터링을 구현하고 보안 사고 대응 강화 및 취약성 패치 수리가 필요합니다.조직은 취약성 스캔 도구, 보안 사고 모니터링 시스템 및 비상 대응 계획을 사용하여 제로 데이 취약점의 위협을 처리 할 수 있습니다."
"클라우드 환경에서 IM (Identity and Access Management)을 구현하는 방법은 무엇입니까?","신원 및 액세스 관리를 구현하려면 사용자 인증, 승인 정책, ACLS (Access Control Lists), 역할 관리 및 기타 측정을 설정해야합니다.조직은 ID (Identity Provider), 단일 사인온 (SSO), 다중 인증 인증 및 기타 기술을 사용하여 IAM 보안을 향상시킬 수 있습니다."
"클라우드 위협 인텔리전스 공유의 중요성과 실용적인 방법을 설명하십시오.","클라우드 위협 인텔리전스 공유는 클라우드 서비스 제공 업체와 보안 공급 업체 간의 보안 위협 인텔리전스 공유 활동 및 공격 정보를 말합니다.그 중요성에는 적시에 위협 감지, 보안 방어 효과 개선 및 산업 협력 증진이 포함됩니다.실용적인 방법에는 신뢰 관계 설정, 안전한 정보 교환 플랫폼 설정 및 공유 사양을 공식화하는 것이 포함됩니다."
"DGA 도메인 탐지에서 위협 인텔리전스는 어떤 역할을합니까?","위협 인텔리전스는 알려진 악성 도메인 이름을 감지하고 차단하는 데 사용할 수있는 알려진 DGA 도메인 이름 정보를 제공합니다."
"""서비스로서의 주요 관리""(KMAAS) 란 무엇입니까?","키 호스팅은 클라우드 환경에서 암호화 키를 관리하고 보호하는 클라우드 보안 서비스입니다.주요 생성, 스토리지, 회전, 액세스 제어 등과 같은 기능을 포함하여 안전한 키 관리 솔루션을 제공합니다."
"클라우드 환경에서 안전한 신원 및 액세스 관리를 구현하는 방법은 무엇입니까?","안전한 신원 및 액세스 관리를 실현하려면 통합 신원 인증 및 인증 메커니즘을 설정하고, 다중 인증 인증을 구현하며, 최소 권한의 원칙, 실시간 모니터링 및 감사 액세스 동작 및 기타 조치를 채택해야합니다.조직은 ID (Identity and Access Management) 서비스, SSO (Single Sign-On) 솔루션 및 액세스 제어 정책으로 사용자 및 리소스의 보안 관리를 강화할 수 있습니다."
"클라우드 환경에서 보안 모니터링 및 준수 감사를 구현하는 방법은 무엇입니까?","보안 모니터링 및 규정 준수 감사를 달성하려면 보안 사고 모니터링 및 분석 시스템을 설정하고 로그 관리 및 감사 제어를 구현하며 정기 준수 감사 및보고를 수행해야합니다.조직은 SIEM (Security Information and Event Management) 도구, 규정 준수 관리 플랫폼, 타사 감사 서비스 등을 사용하여 클라우드 환경의 보안 모니터링 및 준수 감사를 강화할 수 있습니다."
"""CASB (Cloud Access Security Broker)""란 무엇입니까?","Cloud Access Security Agent는 클라우드 환경에서 클라우드 애플리케이션 및 데이터의 액세스 및 사용을 모니터링, 제어 및 보호하는 데 사용되는 보안 도구입니다.액세스 제어, 데이터 암호화, 위협 감지 및 기타 기능을 구현하여 클라우드 환경의 보안을 향상시킬 수 있습니다."
"실제 응용 분야에서 두 가지 다른 위협 모델링 방법 (보폭 및 공포 등)의 장점과 단점을 분석하고 비교하십시오. 클라우드 컴퓨팅 서비스를 예로 들어 위협 모델링 방법을 선택할 때 고려해야 할 요소를 설명하십시오.","보폭의 장점은 포괄적이며 다양한 위협 유형을 포괄하며 다양한 잠재적 보안 문제를 식별하는 데 적합하다는 것입니다.그러나 그 단점은 너무 상세하고 초보자가 이해하고 적용하기가 어려울 수 있습니다.클라우드 컴퓨팅 서비스에서 Stride는 신원 위조 및 데이터 변조와 같은 광범위한 보안 위협을 식별하는 데 도움을 줄 수 있습니다.\n\n두려운 방법은 위협의 심각성을 정량화하는 데 더 중점을두고 의사 결정자가 위협을 우선시하는 데 도움이됩니다.그것의 장점은 다른 위협을 비교하는 것이 직관적이고 쉽다는 것입니다.그러나 공포는 규정 준수 요구 사항과 같은 일부 비 정량적 요인을 무시할 수 있으며 모든 유형의 위협을 식별하기에 충분하지 않을 수 있습니다.클라우드 컴퓨팅 서비스의 경우, 위험이 높은 문제의 우선 순위를 정하기 위해 비즈니스에 대한 위협의 영향을 평가하는 데 Dread가 더 적합 할 수 있습니다.\n\n위협 모델링 방법을 선택할 때 다음 요소를 고려해야합니다.\n1. 팀 친숙 함 : 팀이 보폭을 깊이 이해하고 있다면 더 나은 선택 일 수 있습니다.\n2. 서비스 복잡성 : 크고 복잡한 클라우드 서비스의 경우 Stride는 포괄적성에 더 많은 장점이있을 수 있습니다.\n3. 정량적 요구 사항 : 위협의 심각성을 정량화 해야하는 경우 공포가 더 적절할 수 있습니다.\n4. 규정 준수 : 규정 준수 요구 사항과 같은 비 정량적 요인을 고려해야하는지 여부를 고려하십시오."
"클라우드 환경에서 데이터 백업 및 복구를 관리하고 보호하는 방법은 무엇입니까?","데이터 백업 및 복구를 관리하고 보호하려면 백업 데이터의 무결성 및 가용성을 보장하기 위해 암호화, 액세스 제어, 백업 스토리지 격리 및 기타 조치가 필요합니다.조직은 백업 및 복구 서비스, 데이터 백업 정책, 재해 복구 계획 및 기타 기술을 사용하여 데이터 백업 및 복구의 관리 및 보호를 강화할 수 있습니다."
"어떤 유형의 네트워크 계층 DDOS 공격이 Anti-D를 방어 할 수 있습니까?","Cloud Anti-D는 SYN 홍수 공격, ACK 홍수 공격, NTP 반사 증폭 공격 등과 같은 대규모 교통 네트워크 계층 DDOS 공격을 방어 할 수 있습니다."
"클라우드 환경에서 안전한 API 관리를 구현하는 방법은 무엇입니까?","보안 API 관리를 구현하려면 API 인증, 액세스 제어 및 데이터 암호화를 사용해야합니다.조직은 API 게이트웨이, API 키 및 OAUTH 인증을 사용하여 API 액세스 및 데이터 전송의 보안 관리를 강화할 수 있습니다."
"클라우드 보안 책임 모델의 개념과 적용을 설명하십시오.","클라우드 보안 책임 모델은 클라우드 서비스 제공 업체 (CSP)와 고객 간의 보안 책임 부서 및 부서를 지정합니다.이 모델에서 CSP는 클라우드 인프라의 보안을 담당하는 반면 고객은 응용 프로그램 및 데이터의 보안을 담당합니다."
"클라우드 네이티브 환경에서 데이터 암호화의 올바른 구현을 보장하는 방법은 무엇입니까?","데이터 암호화의 올바른 구현을 보장하려면 강력한 암호화 알고리즘, 데이터 저장 및 전송을 다루기위한 암호화 정책 구현, 주요 관리 구현이 필요합니다.클라우드 기본 환경에서 KMS (키 관리 서비스)를 사용하여 암호화 키를 관리하고 모든 환경에서 암호화 정책의 일관성을 보장 할 수 있습니다."
"클라우드 환경에서 ""보안 평가 및 규정 준수 감사""의 역할과 프로세스는 무엇입니까?","보안 평가 및 규정 준수 감사는 클라우드 환경에서 보안 제어 및 준수 요구 사항을 평가하고 감사하는 프로세스를 말합니다.프로세스에는 보안 취약성 스캔, 준수 점검, 보안 위험 평가,보고 및 개선 등이 포함됩니다."
"클라우드 환경에서 데이터의 기밀성과 무결성을 보호하는 방법은 무엇입니까?","데이터의 기밀성과 무결성을 보호하려면 암호화, 액세스 제어 및 무결성 검증과 같은 조치가 필요합니다.예를 들어, 암호화 알고리즘은 데이터를 암호화하고 인증 및 인증 메커니즘을 구현하여 데이터 액세스를 제어하며 디지털 서명을 사용하여 데이터 무결성을 검증하는 데 사용됩니다."
"클라우드 네이티브 환경에서 마이크로 서비스의 엔드 포인트 보안을 보장하는 방법은 무엇입니까?","엔드 포인트 보호 측정을 구현하고, 서비스에 대한 액세스 제한, HTTPS와 같은 보안 통신 프로토콜 (예 : HTTP)을 구현하고 마이크로 서비스 프로토콜 (예 : HTTPS)을 구현하고 마이크로 서비스에 대한 모니터링 및 응답을 가능하게함으로써 마이크로 서비스 엔드 포인트의 보안을 달성 할 수 있습니다."
"컨테이너 오케스트레이션 보안의 중요성과 과제는 무엇입니까?","컨테이너 오케스트레이션 보안은 보안 위협 및 공격으로부터 컨테이너 오케스트레이션 플랫폼 (예 : Kubernetes)을 보호하기위한 일련의 조치를 나타냅니다.문제에는 컨테이너 취약성, API 보안, 권한 관리 등이 포함됩니다."
"클라우드 환경에서 로그 데이터를 효과적으로 관리하고 모니터링하는 방법은 무엇입니까?","로그 데이터를 효과적으로 관리하고 모니터링하려면 로그 수집, 스토리지, 분석 및보고와 같은 조치를 취해야합니다.조직은 로그 관리 도구 및 보안 정보 및 이벤트 관리 (SIEM) 시스템을 사용하여 클라우드 환경에서 로그 데이터의 포괄적 인 모니터링 및 분석을 달성 할 수 있습니다."
"무단 액세스로부터 사용자 데이터를 보호하기위한 인증 및 인증 메커니즘이 포함 된 안전한 클라우드 스토리지 서비스를 설계하십시오.OAUTH 2.0 또는 기타 관련 프로토콜을 사용 하여이 목표를 달성하고 가능한 보안 문제에 대해 논의하는 방법을 설명하십시오.","안전한 클라우드 스토리지 서비스를 설계하려면 OAUTH 2.0 프로토콜을 사용하여 인증 및 인증을 구현할 수 있습니다.사용자는 먼저 등록하고 로그인 한 다음 서비스 제공 업체가 OAUTH 2.0 인증 프로세스를 통해 데이터에 액세스 할 수 있도록합니다.서비스 제공 업체는 후속 리소스 요청에 대한 액세스 토큰 및 새로 고침 토큰을 생성합니다.보안 문제에는 토큰 보호, 만료 관리, 취소 메커니즘 및 보안 경계 및 감사 모니터링이 포함됩니다.이러한 측정을 구현함으로써 사용자 데이터를 무단 액세스로부터 보호 할 수 있습니다."
"컨테이너 이미지 보안의 중요성과 구현을 설명하십시오.","컨테이너 미러링 보안은 컨테이너 배포의 보안 및 안정성을 보장하기 위해 보안 취약점 및 악성 코드로부터 컨테이너 이미지를 보호하는 것을 말합니다.구현 방법에는 미러 스캔, 취약성 수리, 미러 서명 및 컨테이너 권한 제한이 포함됩니다."
"특히 데이터 수집, 사용자 권리 및 법 집행 메커니즘 측면에서 사용자 동의 원칙적으로 GDPR (European General Data Protection Regulation)과 CCPA (California Consumer Privacy Act)의 유사점과 차이점을 분석하고 비교하십시오.","사용자 동의 원칙에서 GDPR과 CCPA의 주요 차이점은 GDPR이 명확한 동의 프로세스를 강조하는 반면 CCPA는 사용자의 개인 정보에 대한 사용자의 통제에 더 많은 관심을 기울인다는 것입니다.데이터 수집과 관련하여 둘 다 투명성이 필요하지만 GDPR은 더 제한적입니다.사용자 권한 측면에서 사용자는 사용자가 데이터에 액세스하고 삭제할 수 있지만 GDPR은 더 넓은 권한 범위를 가지고 있습니다.법 집행 메커니즘 측면에서 GDPR은 규제 기관을 통해 시행되며 벌금은 심각합니다. CCPA는 개별 소송 및 법무 장관의 행동에 의존합니다."
"회사가 귀하의 이메일 마케팅 캠페인이 CAN-Spam Act를 위반한다고 주장하는 불만을 접수한다고 가정합니다.취할 조사 단계를 나열하고 이러한 단계가 준수를 결정하는 데 어떻게 도움이 될 수 있는지 설명하십시오.","불만을 접수 한 후, 우리는 CAN-Spam 법이 위반되는지 여부를 조사하기 위해 다음 조치를 취할 것입니다.\n1. 연구 규정 : 이메일 내용을 평가할 수 있도록 법의 특정 요구 사항을 이해합니다.\n2. 정보 수집 : 이메일의 내용 및 고소인의 주장을 포함하여 불만 사항에 대한 세부 정보를 자세히 기록하십시오.\n3. 이메일 검토 : 이메일이 주제, 컨텐츠, 구독 취소 옵션 등과 같은 CAN-Spam ACT 준수 표준을 준수하는지 확인하십시오.\n4. 정책 분석 보내기 : 이메일 보내기 정책이 구독 및 구독 요청을 올바르게 처리하는지 확인하십시오.\n5. 사용자 피드백 분석 : 다른 사용자의 피드백을 확인하여 이것이 널리 퍼져 있는지 확인하십시오.\n6. 법률 상담 : 필요한 경우 전문가 전문가와상의하여 전문적인 조언을 드리겠습니다.\n\n이 단계는 포괄적 인 방식으로 문제를 이해하고 규정이 위반되는지 여부를 결정하며 가능한 개선의 근거를 제공하는 데 도움이됩니다."
"회사의 메일 시스템이 GDPR (European General Data Protection Regulation) 준수 요구 사항을 충족해야한다고 가정합니다.최소한 3 가지 주요 규정 준수 정책을 나열하고 개인 데이터의 보안을 어떻게 보장하는지 설명하십시오.","1. ** 데이터 최소화 ** : GDPR에 따르면 회사는 비즈니스 목적을 처리하는 데 필요한 개인 데이터 만 수집해야합니다.우편 시스템에서, 이것은 민감한 개인 정보와 같은 불필요한 개인 정보가 절대적으로 필요한 경우가 아니라면 저장해서는 안된다는 것을 의미합니다.시스템은 관련이 없거나 구식 개인 데이터를 자동으로 필터링하고 삭제해야합니다.\n\n2. ** 사용자 투명성 및 권리 ** : GDPR은 사용자가 데이터를 알고 제어 할 권리가 있어야합니다.메일 시스템은 사용자에게 데이터 수집, 사용 및 저장 방법을 알려주는 명확한 개인 정보 보호 정책을 제공해야합니다.또한 시스템은 데이터 휴대 성뿐만 아니라 데이터에 액세스, 수정 및 삭제하는 사용자의 기능을 지원해야합니다.\n\n3. ** 보안 조치 ** : GDPR에는 개인 데이터의 보안을 보호하기 위해 적절한 기술 및 조직 조치가 필요합니다.메일 시스템은 전송 및 스토리지 중 데이터 보안을 보장하기 위해 강력한 암호화 메커니즘이 있어야합니다.또한 액세스 제어 및 감사 로그를 사용하여 데이터에 액세스 한 사람,시기 및 위치를 추적해야합니다.\n\n이러한 전략은 개인 데이터의 보호를 보장하고, 데이터 위반의 위험을 줄이며, 회사가 법이 요구하는 범위 내에서 운영을 돕고 가능한 벌금 또는 법적 분쟁을 방지하도록 도와줍니다."
"다른 국가의 법적 대응을 조정하는 방법과 통합 된 글로벌 사이버 보안 규정없이 직면 할 수있는 문제에 대해 논의하기 위해 국경 간 데이터 위반을 예로 들어보십시오.","초 국가적 데이터 유출을 다룰 때, 법적 대응 조정은 국가 간의 사이버 보안 규정의 차이로 인해 복잡한 작업입니다.예를 들어, 회사가 EU에서 데이터 위반을 경험하는 경우 데이터 주제의 권리, 데이터 유출 알림 요구 사항과 같은 엄격한 GDPR 규정을 준수해야 할뿐만 아니라 높은 벌금에 처할 수 있습니다.한편, 회사가 미국에서 운영되는 경우 다른 데이터 수집 및 사용 규정이 포함될 수있는 CCPA 준수를 고려해야합니다.\n\n글로벌 통합 사이버 보안 규정이 없으면 조정의 열쇠는 국제 법적 협력에 있습니다.예를 들어, 양자 또는 다자 조약을 통해 국가는 데이터 유출 조사 및 처리에 서로를 지원하기로 동의 할 수 있습니다.OECD 및 유엔과 같은 국제기구는 지침 원칙과 모범 사례의 발전을 촉진 할 수 있습니다.또한 회사는 데이터 처리 활동이 모든 관련 국가의 규정을 준수하도록하기 위해 글로벌 규정 준수 프레임 워크를 설정해야합니다.\n\n그러나이 과정에는 많은 도전이있을 것입니다.법의 충돌로 인해 회사가 어떤 국가 규정을 따라야하는지 결정하기가 어려울 수 있습니다.국경 간 문제로 인해 증거 수집이 어려워 질 수 있으며 국가의 법 집행 기관의 조정이 필요합니다.또한 국가 별 국경 간 데이터 전송에 대한 제한은 정보를 적시에 공유하고 이벤트에 대한 빠른 응답에 영향을 줄 수 있습니다."
"전자 상거래 회사는 PCI DSS (지불 카드 산업 데이터 보안 표준)를 준수하지 않은 것에 대해 큰 처벌을 받았습니다.회사가 실수를 저지른 주요 영역을 분석하고 향후 규제 준수를 보장하기 위해 제안을 수정하십시오.","회사는 다음과 같은 주요 영역에서 실수를했을 수 있습니다.\n1. 데이터 보호 : 저장된 지불 카드 정보를 암호화하지 않거나 전송 중에 보안 프로토콜이 사용되지 않을 수 있습니다.\n2. 네트워크 보안 : 방화벽은 부적절하게 구성되거나 무단 액세스를 차단하지 않거나 네트워크 취약점이 제 시간에 고정되어 있지 않을 수 있습니다.\n3. 액세스 제어 : 과도한 직원이 결제 카드 데이터에 액세스 할 수 있도록 엄격한 액세스 제어 조치를 구현하지 못할 수 있습니다.\n4. 감사 및 모니터링 : 지속적인 모니터링 및 로깅이 부족할 수 있으며 적시에 비정상적인 활동을 감지 할 수 없습니다.\n5. 응용 프로그램 보안 : 온라인 거래 시스템에는 보안 취약점이 있으며 공격에 취약합니다.\n\n실수 수정에 대한 제안 :\n1. 데이터 암호화 구현 : 결제 카드 정보를 저장하고 전송할 때 업계 표준 암호화가 사용되도록합니다.\n2. 네트워크 보안 최적화 : 방화벽 규칙을 업데이트하고 강화하며 정기적 인 취약성 스캔 및 침투 테스트를 수행합니다.\n3. 액세스 제어 강화 : 결제 카드 데이터에 대한 액세스 제한, 필요한 인원 만 승인하며 다중 인증을 구현합니다.\n4. 모니터링 메커니즘 설정 : 로그 관리 및 모니터링 시스템을 구현하여 잠재적 인 위협을 신속하게 감지하고 대응합니다.\n5. 교육 및 정책 : PCI DSS 규정 준수에 대한 직원을 교육하기위한 엄격한 안전 정책을 개발하고 구현합니다."
