Question,Answer
"CSRF (크로스 사이트 요청 위조) 공격의 작업 메커니즘을 설명하고 은행 이전 시나리오에서 예를 들어 보입니다.그런 다음 토큰 검증을 포함한 방어 전략을 설계하고 코드 검토 중에 응용 프로그램을 설명하십시오.","CSRF 공격은 사이버 공격 방법입니다. 공격자는 피해자의 로그인 신원을 사용하여 악의적 인 요청을 구성하여 피해자가 예기치 않은 작업을 수행하도록 유도합니다.은행 이체 시나리오에서 사용자 A가 은행 계좌에 로그인했다고 가정하면 공격자 B는 전송 요청이 포함 된 악성 웹 페이지를 만듭니다.사용자 A 가이 웹 페이지를 방문하면 브라우저는 자동으로 사용자 A의 세션 쿠키를 가져옵니다. 사용자 A가 버튼을 클릭하지 않더라도 악의적 인 요청이 은행 서버로 전송되어 자금이 A의 계정에서 B의 지정된 계정으로 이체됩니다.\n\nCSRF 공격을 방어하는 일반적인 전략은 토큰 검증을 사용하는 것입니다.민감한 작업 (예 : 전송)에서 서버는 임의의 일회성 토큰을 생성하여 사용자 세션에 저장합니다.양식을 제출할 때 사용자는이 토큰을 숨겨진 필드로 서버로 다시 보내야합니다.서버는 토큰이 유효한지 확인하고 세션에서 토큰과 일치합니다.일치하면 요청이 실행됩니다.\n\n코드 검토 과정에서 개발자는 다음을 확인해야합니다.\n- 모든 민감한 작업 (예 : 전송, 암호 수정)에 대한 요청에는 토큰이 포함됩니다.\n- 토큰은 서버 측에서 올바르게 생성되어 세션에 저장됩니다.\n- 토큰은 클라이언트의 양식에 올바르게 추가되어 서버로 다시 전송됩니다.\n- 서버 측 코드는 토큰의 유효성을 확인하고 확인이 통과 된 후 작업을 수행합니다."
"질문 1 : 두 가지 유형의 맬웨어 (예 : 바이러스 및 랜섬웨어)를 설명하고 비교하고 서명 탐지 및 행동 분석에 의해 어떻게 구별되는지 설명하십시오.","** 바이러스 **는 일반적으로 사용자의 지식없이 다른 프로그램과 스프레드를 첨부하는 자체 코핑 맬웨어입니다.바이러스는 일반적으로 이메일, 다운로드 소프트웨어 또는 감염된 저장 장치를 통해 전송됩니다.시그니처 탐지 방법은 주로 바이러스를 목표로하며, 알려진 바이러스 (즉, 서명)의 특정 코드 시퀀스를 찾아서 식별합니다.일치하는 서명이 감지되면 보안 소프트웨어는 바이러스가이를 실행하거나 지우는 것을 방지합니다.\n\n** 랜섬웨어 **는 사용자의 파일을 암호화하고 해독에 랜섬 결제가 필요한보다 현대적인 위협입니다.랜섬웨어는 종종 피싱, 악성 광고 또는 익스플로잇을 통해 장치를 감염시킵니다.바이러스와 달리 랜섬웨어는 명백한 자체 복제 행동을 가질 수 없습니다.행동 분석은 파일 암호화, 무단 네트워크 통신 또는 시스템 수정과 같은 악의적 인 행동을 감지하는 데 중점을 둡니다.특정 서명이 없어도 보안 소프트웨어는 비정상적인 동작을 분석하여 랜섬웨어를 식별 할 수 있습니다.\n\n바이러스는 코드 패턴이 비교적 고정되어 있기 때문에 ** 시그니처 감지에 의해 더 쉽게 식별되는 반면, 랜섬웨어는 서명 감지를 피하기 위해 계속 진화 할 수 있으므로 더 복잡한 행동 분석이 필요할 수 있습니다.\n\n** 행동 분석 **는 특정 코드 시퀀스가 아닌 프로그램의 동작 패턴에 중점을두기 때문에 알려지지 않은 또는 변형 악성 코드를 감지하는 데 더 적합합니다.랜섬웨어의 경우 행동 분석은 파일 암호화, 시스템 잠금 등과 같은 비정상적인 행동을 감지 할 수 있으며 알려진 바이러스 서명이 없어도 위협을 식별 할 수 있습니다."
"위조 이메일과 같은 일반적인 피싱 공격을 분석하십시오.사회 공학 원칙과 사용자 교육, 이메일 필터링 및 보안 인식 교육을 통해 이러한 공격이 발생하는 것을 방지하는 방법을 설명하십시오.","위조 전자 메일과 같은 피싱 공격은 사기성이며 사회 공학 원칙을 이용하는 수단입니다.공격자는 종종 은행이나 소셜 미디어 플랫폼과 같은 신뢰할 수있는 엔티티로 변장하고, 합법적 인 이메일을 보내고, 피해자가 악의적 인 링크 나 첨부 파일을 클릭하여 민감한 정보를 훔치거나 맬웨어를 설치하도록 유도합니다.\n\n사회 공학의 핵심은 사람들의 신뢰, 호기심 및 긴급 성을 활용하는 것입니다.위조 이메일에서 공격자는 비상 사태를 만들거나 피해자에게 즉시 행동하도록 요청하거나 개인 정보를 얻기 위해 유혹적인 보상을 제공 할 수 있습니다.\n\n이러한 공격을 방지하는 핵심은 사용자의 보안 인식을 향상시키고 효과적인 방어 전략을 구현하는 것입니다.\n1. ** 사용자 교육 ** : 직원들이 일반적인 피싱 기술을 이해하고 철자 오류, 비정상적인 발신자 주소, 즉각적인 조치 요청 등과 같은 의심스러운 이메일의 특성을 식별하는 법을 배웁니다.\n2. ** 메일 필터링 ** : 악의적 인 링크 나 첨부 파일이받은 편지함에 들어가는 것을 감지하고 차단할 수있는 강력한 이메일 필터링 시스템을 배포하십시오.이러한 시스템은 일반적으로 잠재적 인 피싱 시도를 식별하기 위해 이메일의 발신자, 내용 및 첨부 파일을 확인합니다.\n3. ** 안전 인식 교육 ** : 피싱 공격을 시뮬레이션하기위한 교육을 통해 사용자는 안전한 환경에서이를 처리하는 방법을 배울 수 있습니다.이것은 그들의 경고를 향상시키고 실제 상황에서 피싱 공격을 인식하고 피할 가능성이 높아질 수 있습니다.\n\n이러한 조치를 통해 조직과 개인은 피싱 공격의 위험을 크게 줄일 수 있습니다."
"CSRF 공격 과정은 무엇입니까?","공격자는 다른 웹 사이트 페이지에 악의적 인 요청을 추가합니다. 사용자가 페이지에 액세스하면 브라우저는 사용자의 로그인 상태를 사용하여 요청을 보내므로 공격자가 원하는 작업을 수행합니다."
"웹 애플리케이션 침투 테스트에서 API 인터페이스에는 무제한 데이터 다운로드를 허용하는 보안 취약점이 있음을 발견했습니다.이 취약점을 사용하여 다량의 민감한 데이터를 다운로드하는 방법을 설명하고 동시에 취약점을 해결하기위한 제안을 제안하는 공격 계획을 설계하십시오.","공격 계획 :\n1. ** 정보 수집 ** : API 인터페이스의 요청 형식 및 매개 변수를 자세히 연구하여 데이터 다운로드 제한에 영향을 줄 수있는 매개 변수를 결정하십시오.\n2. ** 취약성 검증 ** : 요청을 구성하고 인증 다운로드없이 테스트, 유효하지 않거나 과도한 ID 등을 사용하여 테스트와 같은 기존 액세스 제한을 우회하려고 시도하십시오.\n3. ** 데이터 다운로드 ** : 확인이 성공한 경우 자동화 된 스크립트를 작성하고 많은 법적이지만 무제한 요청을 시뮬레이션하며 민감한 데이터를 지속적으로 다운로드하십시오.Postman 또는 Python의 요청 도서관과 같은 도구를 사용하여 구현할 수 있습니다.\n4. ** 마스크 트레이스 ** : 탐지를 방지하려면 다운로드 속도 제한을 설정하거나 요청 시간을 배포하거나 프록시 IP를 사용할 수 있습니다.\n\n수리 제안 :\n1. ** 권한 제어 ** : API 인터페이스에 엄격한 권한 확인이 있는지 확인하고 승인 된 사용자 만 민감한 데이터에 액세스 할 수 있는지 확인합니다.\n2. ** 요금 제한 ** : 많은 양의 데이터가 단기간에 다운로드되는 것을 방지하기위한 속도 제한 전략을 구현합니다.\n3. ** 데이터 액세스 제한 ** : 무제한 다운로드를 피하기 위해 사용자 역할 또는 권한에 따라 데이터 액세스 범위를 설정하십시오.\n4. ** 입력 확인 ** : 요청 매개 변수를 엄격하게 검증하여 요청의 악성 구성을 방지합니다.\n5. ** 보안 감사 ** : 정기적 인 침투 테스트 및 보안 감사를 수행하여 이러한 취약점을 신속하게 감지하고 수정하십시오."
"블랙리스트 확장 필터링의 단점은 무엇입니까?","제한된 확장은 충분히 완전하지 않으며 파일 업로드 형식은 예측할 수 없으며 확장을 확인하는 방법에 문제가 있으며 우회 할 수 있습니다."
"XSS 취약점이있는 웹 응용 프로그램을 찾지 만 세션 관리에 httponly 쿠키를 사용한다고 가정 해 봅시다.이 XSS 취약점이 여전히 사용자에게 위협이 될 수있는 이유를 설명하고 응용 프로그램의 보안을 향상시키기위한 두 가지 완화 전략을 제안하십시오.","httponly 쿠키는 JavaScript 읽기를 방지하지만 XSS 공격자는 다음과 같은 방식으로 취약점을 악용 할 수 있습니다.\n1. 사회 공학 공격 : 공격자는 가짜 페이지를 생성하고 XSS 주입을 사용하여 사용자의 브라우저에서 실행하여 사용자가 페이지의 사용자 이름, 비밀번호 또는 기타 개인 데이터와 같은 민감한 정보를 입력하도록 유도합니다.\n2. 도움말 XSS는 다른 공격을 수행합니다. HTTPONLY 쿠키를 읽을 수 없더라도 공격자는 XSS를 사용하여 CSRF와 같은 다른 공격을 수행 할 수 있습니다.공격자는 악의적 인 요청이 포함 된 스크립트를 구성 할 수 있습니다. 사용자가 주입 된 페이지에 액세스하면 요청이 자동으로 서버로 전송되어 공격자가 원하는 작업을 수행합니다.\n\n완화 전략 :\n1. 입력 확인 : 악의적 인 스크립트 주입을 방지하기 위해 사용자 입력을 엄격하게 필터링하고 탈출합니다.CSP (Content Security Policy)를 사용하여 브라우저가 신뢰할 수있는 소스에서 스크립트를 실행하는 것을 제한합니다.\n2. httponly 및 Secure 플래그 사용 : httponly 외에도 쿠키가 HTTPS 연결 하에서 만 전송되도록하기 위해 보안 플래그를 설정하고 쿠키를 훔치는 것을 방지하십시오."
"인바운드 및 아웃 바운드 이메일 트래픽을 필터링하여 이메일 게이트웨이 솔루션이 이메일 보안에 어떻게 기여하는지 설명하십시오.","이메일 게이트웨이 솔루션은 조직의 내부 네트워크와 인터넷 사이의 장벽 역할을하며, 인바운드 및 아웃 바운드 이메일 트래픽을 필터링하여 악의적 인 컨텐츠, 스팸 및 피싱 시도를 감지하고 차단합니다."
"취약성 분석에서 웹 애플리케이션의 입력 검증이 충분하지 않으면 SQL 주입이 발생할 수 있습니다.SQL 주입의 원리를 설명하고 실제 공격 예를 제시하고 그러한 공격을 방지하기위한 보안 관리를 설명하십시오.","SQL Injection은 공격자가 악의적으로 구성된 SQL 코드를 입력하여 예기치 않은 데이터베이스 작업을 수행하도록 애플리케이션을 속일 때 발생하는 일반적인 웹 응용 프로그램 보안 취약점입니다.응용 프로그램이 SQL 쿼리에 직접 삽입되는 사용자가 입력 한 데이터를 올바르게 필터링하거나 탈출하지 않으면 공격자는이 취약점을 악용 할 수 있습니다.\n\nAttack example:\n로그인 페이지가 있고 쿼리 구조가 다음과 같습니다.\n````SQL\n사용자에서 username = 'userInput'및 password = 'passwordInput'을 선택하십시오.\n```\n사용자가 입력 한 경우 :\n```텍스트\n'또는'1 '='1 -\n```\n처리 후 쿼리가됩니다.\n````SQL\nusername = '또는'1 '='1 ' -'및 password = 'passwordInput'을 선택하십시오.\n```\n이 쿼리는 '1'= '1'이 항상 사실이기 때문에 모든 사용자에 대한 레코드를 반환합니다.공격자는 올바른 비밀번호를 모르고 로그인 할 수 있습니다.\n\nSQL 주입 방지를위한 보안 관리 조치 :\n1. ** 매개 변수화 된 쿼리 \\/precompiled 문 ** : 매개 변수화 된 쿼리를 사용하여 응용 프로그램은 SQL 문을 직접 구축하는 대신 사용자의 데이터 입력을 매개 변수로 전달합니다.이러한 방식으로 악성 코드가 입력 되더라도 코드가 아닌 데이터로 취급되므로 실행되지 않습니다.\n\n2. ** 입력 확인 및 필터링 ** : 사용자 입력에 대한 엄격한 검증을 수행하여 예상 문자와 형식 만 허용되도록합니다.예를 들어, 사용자 이름의 경우 문자와 숫자 만 허용되며 암호의 경우 길이와 특수 문자가 제한 될 수 있습니다.\n\n3. ** 대량 권한 원칙 ** : 데이터베이스 연결은 최소 권한과 함께 사용자 계정을 사용해야하므로 주입이 발생하더라도 공격자는 데이터 삭제 또는 수정과 같은 고급 작업을 수행 할 수 없습니다.\n\n4. ** 오류 처리 및 로깅 ** : 공격자에게 데이터베이스 구조 또는 정보가 누출되지 않도록 자세한 오류 정보가 사용자에게 표시되지 않습니다.동시에, 예외 쿼리가 기록되고 모니터링되어 잠재적 인 주입 공격을 신속하게 감지하고 응답합니다."
"취약성 분석을 완료하고 민감한 정보 유출이 포함 된 응용 프로그램의 특정 API 인터페이스에 취약성이 있다고 가정합니다.이 위험의 심각성을 계산하고 다음과 같은 요인을 고려하십시오 : 영향의 범위, 가능성 및 잠재적 손실.계산 방법을 설명하십시오.","위험 심각도를 계산하려면 위험 평가 공식을 사용할 수 있습니다 : 위험 심각도 = 영향 범위 × 가능성 × 잠재적 손실\n\n예를 들어 : 다음 :\n- 충격 범위는 중간 (50 포인트)입니다. 일부 사용자와 일부 민감한 데이터에 영향을 미칩니다.\n- 가능성이 높습니다 (80 점) : 알려진 악용 방법이 있으며 API 인터페이스는 공개 네트워크에 노출됩니다.\n- 잠재적 손실이 높습니다 (90 포인트) : 민감한 정보의 고장은 경제적 손실과 평판 손상으로 이어질 수 있습니다.\n\n위험 심각도 = 50 × 80 × 90 = 360,000\n\n따라서이 위험의 심각도 점수는 360,000으로, 이는 위험이 높은 문제이며이를 해결하기 위해 즉각적인 조치가 필요하다는 것을 나타냅니다."
"귀하는 보안 연구원이며 다양한 공격 기술을 활용하는 새롭고 복잡한 맬웨어 제품군을 발견했습니다.정적 분석, 동적 분석 및 리버스 엔지니어링을 포함하여 심층 분석을 수행하여 작동 방식 및 잠재적 방어 전략을 이해하는 방법을 설명하십시오.","보안 연구원으로서 먼저 정적 분석을 수행하고 PEID와 같은 도구를 사용하여 잠재적 인 포격 또는 난독 화 기술을 식별하고 Strings 명령을 사용하여 가능한 명령 줄 매개 변수, URL 또는 C & C 서버 주소를 찾습니다.그런 다음 Wireshark 및 프로세스 모니터와 같은 가상 머신 또는 샌드 박스에서 동적 분석을 수행하여 네트워크 활동 및 맬웨어의 시스템 동작을 관찰합니다.\n\n동적 분석 후 리버스 엔지니어링 단계에 들어가 리버스 엔지니어링 도구를 사용하여 맬웨어의 실행 프로세스를 해독합니다.암호화 된 암호 해독 기능, 통신 모듈 및 악의적 인 동작을 트리거하는 방법에 대한 트리거 포인트와 같은 주요 기능을 찾을 수 있습니다.리버스 분석을 통해 맬웨어가 탐지를 피하는 방법, 확산 방법 및 악의적 인 작업을 수행하는 방법을 이해하려고 노력합니다.\n\n방어 전략을 공식화하기 위해 위의 분석 결과를 바탕으로 다음 제안을하겠습니다.\n- 알려진 C & C 서버와의 통신을 차단하기 위해 방화벽 규칙이 업데이트됩니다.\n- 서명으로 안티 바이러스 소프트웨어를 업데이트하여 맬웨어를 감지하고 차단하십시오.\n- 피싱 이메일이나 악의적 인 링크와 같은 잠재적 공격 벡터를 식별하고 피하도록 사용자에게 교육하십시오.\n- 코드 검토 및 강화를 통해 응용 프로그램 방어 기능을 향상시킵니다."
"출력 인코딩 프로세스 중에 XSS 공격을 피하기 위해 적절한 인코딩 방법을 어떻게 선택해야합니까?다른 시나리오에서 코딩 전략의 예를 제시하십시오.","HTML 컨텍스트에서 HTML 엔티티 인코딩을 사용하여 특수 문자를 ""<""to ""& lt;"", "">""to ""& gt;""와 같은 해당 엔티티로 변환해야합니다.이렇게하면 이러한 문자가 HTML 태그로 해석되는 것을 방지합니다.\n\nJavaScript 코드에서 JavaScript 인코딩을 사용하여 특수 문자를 ""\\""로 ""\\\\\"", ""\\/""로 ""\\\/""와 같은 유니 코드 탈출 시퀀스로 변환하여 주입 공격을 방지하면서 코드의 올바른 실행을 보장해야합니다.\n\nURL 매개 변수에서 URL 인코딩을 사용하여 특수 문자를 """"to ""%20"", ""=""~ ""%3d""와 같은 특수 문자를 인코딩 백분율로 변환하여 매개 변수를 조작하는 것을 피하면서 URL의 올바른 구문 분석을 보장해야합니다.\n\nCSS 컨텍스트에서 CSS 인코딩은 CSS 주입 공격을 방지하기 위해 ""{""to ""\\ 7b"", ""}""to ""\\ 7d""와 같은 특수 문자를 16 진 인코딩으로 변환하는 데 사용해야합니다.\n\nHTML 속성에서 속성 인코딩을 사용하여 특수 문자를 속성 엔티티 인코딩으로 변환하는 데 """" ""& nbsp; 속성 변조를 피하면서 속성 값의 올바른 표시를 보장합니다."
"1. 공격 방법, 목표 및 경제적 손실을 포함하여 유명한 피싱 공격 사건을 설명하십시오.답변에서 공격자가 사회 공학 원칙을 사용하여 피해자를 속이는 방법을 분석하십시오.","2013 년 대상 데이터 유출은 일반적인 피싱 공격 사례입니다.공격자는 가짜 공급 업체 인보이스 이메일을 통해 대상 직원에게 맬웨어가 포함 된 첨부 파일을 보냈습니다.직원은 알지 못하고 첨부 파일을 열었고 맬웨어는 대상의 내부 네트워크를 감염 시켰습니다.공격자는이 포털을 사용하여 Target의 지불 시스템에 액세스하고 약 4 천만 명의 신용 및 직불 카드 정보와 7 천만 명의 고객의 개인 정보를 훔쳤습니다.\n\n이 경우 공격자는 사회 공학의 원칙을 영리하게 이용했습니다.그들은 자신을 신뢰할 수있는 대상 공급 업체로 위장하고 일상적인 비즈니스 프로세스에 대한 직원의 신뢰를 활용하는 겉보기에 합법적 인 이메일을 만들었습니다.첨부 파일의 맬웨어는 공격 수단이며 미끼는 무해한 송장입니다.이 전략은 기대치 (즉, 공급 업체가 송장을 보내는)와 일상 업무에 대한 친숙 함을 악용하여 이메일의 진정한 의도를 의심하지 않고 피해자를 남깁니다."
"전통적인 보안 테스트의 단점은 무엇입니까?","종종 비즈니스 프로세스 설계 결함, 비즈니스 로직, 비즈니스 데이터 흐름, 비즈니스 기관, 비즈니스 데이터 및 기타 비즈니스 시스템의 보안 위험을 무시할 수 있습니다."
"Discuz의 SQL 주입 필터 클래스가 여러 번 우회 된 이유는 무엇입니까?","공격자는 Discuz의 필터링 메커니즘을 지속적으로 연구하기 때문에 필터링 메커니즘에서 취약점을 발견하여 우회를 달성했습니다."
"원치 않는 API 기능을 끄는 이유는 무엇입니까?","원치 않는 API 기능을 끄면 잠재적 인 보안 위험이 줄어들 수 있습니다."
"온라인 쇼핑 플랫폼을 개발할 때 입력 검증 기술을 통해 SQL 주입 공격을 방지하는 방법은 무엇입니까?특정 입력 검증 전략을 설명하고 악의적 인 데이터 주입을 효과적으로 방지하는 방법을 설명하십시오.","온라인 쇼핑 플랫폼을 개발할 때 다음 입력 검증 전략을 사용하여 SQL 주입을 방지 할 수 있습니다.\n\n1. 매개 변수화 된 쿼리 사용 (사전 컴파일 된 문) : 이것은 SQL 주입을 방지하는 가장 효과적인 방법입니다.SQL 쿼리를 작성할 때 사용자가 입력 한 데이터는 SQL 문자열에 직접 스 플라이싱하는 대신 매개 변수로 전달됩니다. 예를 들어, Python의 SQLITE3 라이브러리를 사용하면 다음을 작성할 수 있습니다.\n\n```Python\ncursor.execute ( ""name =?"", ( ""product_name"",)))\n```\n이 예에서 'product_name'은 사용자가 제공하는 입력으로, SQL 문에 직접 삽입되지 않고 매개 변수로 전달되어 악의적 인 SQL 코드 실행을 방지합니다.\n\n2. 제한 입력 길이 : 너무 긴 SQL 문을 방지하기 위해 사용자가 입력 한 데이터 길이를 제한합니다.예를 들어, 사용자 이름의 길이를 20 자 이하로 제한하십시오.\n\n3. 안전 라이브러리 기능 사용 : 예를 들어, PHP의 'MySQLI_REAL_ESCAPE_STRING` 기능을 사용하여 특수 문자를 피하여 SQL 명령의 일부로 해석되지 않도록합니다.\n\n4. 데이터 유형 확인 : 사용자가 입력 한 데이터 유형이 예상 데이터베이스 필드 유형과 일치하는지 확인하십시오.예를 들어, 예상 가격이 숫자 인 경우 입력의 숫자인지 확인하십시오.\n\n5. 흑백 목록 또는 정규 표현식 사용 : 비즈니스 요구에 따라 허용 또는 금지 된 문자 세트를 정의하거나 법적 입력 형식에 맞게 정규 표현을 사용하십시오.\n\n이러한 정책을 통해 악의적 인 사용자가 SQL 주입 공격을 통해 데이터베이스를 조작하는 것을 효과적으로 방지 할 수 있습니다.그러나 입력 검증은 유일한 방어로 간주되어서는 안되며, 최소 권한의 원칙, 데이터베이스 구성 보안 및 정기 업데이트와 같은 다른 보안 측정과 함께 시스템의 보안을 더욱 향상시킬 수 있습니다."
"웹 인터페이스의 보안 위험을 해결하는 방법은 무엇입니까?","인터넷에 노출 된 웹 인터페이스를 완전히 파악하고 보안 테스터를 조정하여 각 인터페이스에서 보안 테스트를 수행합니다. 인터페이스를 열어야하는 웹 인터페이스 보안 사양을 작성하십시오. 보안 사양을 준수해야합니다. 웹 인터페이스 참조는 인증 및 ID 인증을 증가시킵니다. 암호화 및 서명은 전송 중 API 요청 및 응답의 데이터 기밀성 및 무결성을 보장하는 데 사용됩니다 (변조되지 않음). 불필요한 API 함수를 끄십시오 (예 : 파일 업로드 함수); API가 파일 업로드 함수를 사용해야하는 경우 파일 확장 업로드 (또는 강제 변경), 컨텐츠 및 형식의 준수 감지를 수행하고 동시에 업로드 폴더의 실행 권한을 닫습니다."
"이메일 보안 인식 교육 프로그램은 직원들이 피싱 공격을 인식하고 대응하는 데 어떻게 도움이되며, 효과적인 교육 이니셔티브를 구현하기위한 모범 사례는 무엇입니까?","이메일 보안 인식 교육 프로그램은 직원들에게 피싱 공격의 위험에 대해 교육하고, 일반적인 피싱 지표를 인식하도록 가르치고, 의심스러운 이메일에 적절하게 응답하는 방법에 대한 지침을 제공합니다.모범 사례에는 대화 형 교육 모듈, 시뮬레이션 된 피싱 운동, 신흥 위협에 대한 정기적 인 업데이트 및 지속적인 의사 소통 및 피드백을 통한 강화가 포함됩니다."
"헤더 주입에서 일반적으로 어떤 헤더 필드가 일반적입니까?","사용자 에이전트, 참조 및 클라이언트 -IP \/x-forward-for는 헤더 주입의 일반적인 헤더 필드입니다."
